iso_timestamp,short_id,severity,area,files,context_or_repro,root_cause,fix_summary,verification,status,commit
2025-10-18T02:19:15-07:00,trading-websocket-01,high,trading,auth-backend/routes/trading.js,"Server crashes on startup with MODULE_NOT_FOUND for ../websocket-client","websocket-client.js was deleted but trading.js still required it","Commented out require and replaced initializeWebSocket with stub returning null WebSocket object; getStockQuote falls back to REST API",server startup,fixed,
2025-10-18T02:22:26-07:00,shop-items-update-01,low,shop,"auth-backend/routes/shop.js,stockbuddy/src/pages/Shop.jsx","User requested removal of Coin Starter Pack and addition of more useful shop items","Coin Starter Pack was not useful; needed more variety in shop","Removed Coin Starter Pack; added XP Bundle (instant 200 XP), Lesson Skip Token (skip lessons), and Streak Freeze (3-day protection); implemented purchase logic and success messages",manual shop testing,fixed,
2025-11-07T20:42:35-08:00,shop-inventory-activation-01,medium,shop,"auth-backend/routes/shop.js,auth-backend/routes/auth.js,stockbuddy/src/services/api.js,stockbuddy/src/pages/Inventory.jsx,stockbuddy/src/pages/Shop.jsx","Shop items activated immediately after purchase without inventory control","Purchase handler auto-applied effects instead of deferring activation","Defer activation by storing purchases, add /shop/use API, and update inventory UI to trigger effects on demand",manual inventory testing,fixed,
2025-11-07T20:53:40-08:00,shop-inventory-activation-02,critical,shop,stockbuddy/src/pages/Inventory.jsx,"Inventory card still showed no activate affordance for ready items","UI only rendered buttons when IDs resolved correctly, leaving older purchases without a visible CTA","Guard resolvePurchaseId usage and render primary Activate button whenever an item is ready",manual inventory testing,fixed,
2025-11-07T20:58:00-08:00,shop-inventory-activation-03,critical,shop,"auth-backend/routes/auth.js","Inventory still showed boosters as auto-activated immediately after purchase","Legacy purchase records were stored with active=true and never reset when fetched","Sanitize purchasedItems in user-data endpoint to reset stray active flags unless consumed; persist cleanup to storage (requires server restart to take effect)",manual inventory testing,fixed,
